{
  "brief_id": "a2e9c114a003",
  "version": 1,
  "route": "clear",
  "status": "planning",
  "fields": {
    "topic": {
      "value": "演示文稿策划与质检流程示例（纯合成内容）",
      "status": "provided",
      "origin": {
        "type": "file",
        "locator": "合成示例项目说明"
      },
      "confidence": 1.0,
      "blocking_scope": []
    },
    "audience": {
      "value": "演示文稿策划团队成员；非临床人员、非患者受众",
      "status": "provided",
      "origin": {
        "type": "file",
        "locator": "合成示例项目说明"
      },
      "confidence": 1.0,
      "blocking_scope": []
    },
    "baseline_knowledge": {
      "value": "不要求医学或临床背景",
      "status": "provided",
      "origin": {
        "type": "file",
        "locator": "合成示例项目说明"
      },
      "confidence": 1.0,
      "blocking_scope": []
    },
    "learning_outcomes": {
      "value": [
        "辨认需求访谈、内容策划、审阅与交付之间的关系",
        "根据内容选择合适的信息表达形式",
        "说明交付前应完成的核对"
      ],
      "status": "provided",
      "origin": {
        "type": "file",
        "locator": "合成示例项目说明"
      },
      "confidence": 1.0,
      "blocking_scope": []
    },
    "purpose": {
      "value": "仅演示本技能支持的可编辑图形结构，不提供医学知识或临床建议",
      "status": "provided",
      "origin": {
        "type": "file",
        "locator": "合成示例项目说明"
      },
      "confidence": 1.0,
      "blocking_scope": []
    },
    "delivery_context": {
      "value": "内部软件能力演示",
      "status": "provided",
      "origin": {
        "type": "file",
        "locator": "合成示例项目说明"
      },
      "confidence": 1.0,
      "blocking_scope": []
    },
    "duration": {
      "value": {
        "minutes": 8,
        "interaction_minutes": 1
      },
      "status": "provided",
      "origin": {
        "type": "file",
        "locator": "合成示例项目说明"
      },
      "confidence": 1.0,
      "blocking_scope": []
    },
    "slide_count_policy": {
      "value": {
        "mode": "exact",
        "count": 6
      },
      "status": "defaulted",
      "origin": {
        "type": "file",
        "locator": "合成示例项目说明"
      },
      "confidence": 1.0,
      "blocking_scope": []
    },
    "language": {
      "value": "中文；流程与说明用中文；保留技术缩写和专有名词原文",
      "status": "provided",
      "origin": {
        "type": "file",
        "locator": "合成示例项目说明"
      },
      "confidence": 1.0,
      "blocking_scope": []
    },
    "institution_context": {
      "value": "纯合成演示；不代表真实机构",
      "status": "provided",
      "origin": {
        "type": "file",
        "locator": "合成示例项目说明"
      },
      "confidence": 1.0,
      "blocking_scope": []
    },
    "scope": {
      "value": "展示六种可编辑的内容表达形式；不含医学教学",
      "status": "provided",
      "origin": {
        "type": "file",
        "locator": "合成示例项目说明"
      },
      "confidence": 1.0,
      "blocking_scope": []
    },
    "preserve_items": {
      "value": [
        "清晰标明所有虚构数据",
        "不含患者材料、品牌或真实医学主张"
      ],
      "status": "provided",
      "origin": {
        "type": "file",
        "locator": "合成示例项目说明"
      },
      "confidence": 1.0,
      "blocking_scope": []
    },
    "allowed_changes": {
      "value": "可为可读性调整版式和措辞",
      "status": "provided",
      "origin": {
        "type": "file",
        "locator": "合成示例项目说明"
      },
      "confidence": 1.0,
      "blocking_scope": []
    },
    "template_brand": {
      "value": "浅色背景、深色文字和青绿色强调；微软雅黑",
      "status": "defaulted",
      "origin": {
        "type": "file",
        "locator": "合成示例项目说明"
      },
      "confidence": 1.0,
      "blocking_scope": []
    },
    "source_policy": {
      "value": "纯合成示例，无外部事实主张",
      "status": "provided",
      "origin": {
        "type": "file",
        "locator": "合成示例项目说明"
      },
      "confidence": 1.0,
      "blocking_scope": []
    },
    "network_policy": {
      "value": {
        "allow_public_web": false,
        "local_only": true
      },
      "status": "provided",
      "origin": {
        "type": "file",
        "locator": "合成示例项目说明"
      },
      "confidence": 1.0,
      "blocking_scope": []
    },
    "assets_available": {
      "value": [],
      "status": "provided",
      "origin": {
        "type": "file",
        "locator": "合成示例项目说明"
      },
      "confidence": 1.0,
      "blocking_scope": []
    },
    "privacy_constraints": {
      "value": {
        "patient_data": "无",
        "cloud_processing": "合成示例，不含敏感信息",
        "public_distribution": "合成内容可公开"
      },
      "status": "provided",
      "origin": {
        "type": "file",
        "locator": "合成示例项目说明"
      },
      "confidence": 1.0,
      "blocking_scope": []
    },
    "evidence_requirements": {
      "value": "所有图表数值显式作为虚构合成数据标记",
      "status": "provided",
      "origin": {
        "type": "file",
        "locator": "合成示例项目说明"
      },
      "confidence": 1.0,
      "blocking_scope": []
    },
    "notes_profile": {
      "value": "每页一条简短中文讲者提示",
      "status": "provided",
      "origin": {
        "type": "file",
        "locator": "合成示例项目说明"
      },
      "confidence": 1.0,
      "blocking_scope": []
    },
    "deliverables": {
      "value": [
        "pptx"
      ],
      "status": "provided",
      "origin": {
        "type": "file",
        "locator": "合成示例项目说明"
      },
      "confidence": 1.0,
      "blocking_scope": []
    },
    "acceptance_criteria": {
      "value": [
        "六页均可编辑",
        "至少展示五种不同的视觉表达",
        "每页有中文讲者备注",
        "无临床主张"
      ],
      "status": "provided",
      "origin": {
        "type": "file",
        "locator": "合成示例项目说明"
      },
      "confidence": 1.0,
      "blocking_scope": []
    },
    "assumptions": {
      "value": [
        "柱状图中的 2、5、4 仅为虚构演示数值"
      ],
      "status": "provided",
      "origin": {
        "type": "file",
        "locator": "合成示例项目说明"
      },
      "confidence": 1.0,
      "blocking_scope": []
    },
    "existing_materials": {
      "value": [],
      "status": "provided",
      "origin": {
        "type": "file",
        "locator": "合成示例项目说明"
      },
      "confidence": 1.0,
      "blocking_scope": []
    }
  },
  "unresolved_items": [],
  "history": [],
  "brief_hash": "4afb08497195890d4330f347a8c648b2be36cb18611730ce8268778ec083f371"
}
